{
  "protocol_version": "1.0",
  "ece_protocol": "labelwise, 15 adaptive equal-frequency bins, N_pos>=5 (test)",
  "selection_rule": "lex_ECE_threshold_AUC_param",
  "results": [
    {
      "method": "asl",
      "calibrator": "C0_raw",
      "seed": 123,
      "backbone": "simpleresnet1d_4m",
      "is_selected": false,
      "macro_auc": 0.9111371626565808,
      "labelwise_ece": 0.14991033962768877,
      "macro_brier": 0.03026347494303198,
      "calib_slope": 3.55259971331208,
      "calib_intercept": -0.3659864934333565,
      "threshold_transfer_gap_at_sens_0.9": 0.07445558867200543,
      "family_ece": {
        "NORM": 0.1385536038768465,
        "MI": 0.1572687171725429,
        "STTC": 0.15154297548705814,
        "CD": 0.15251298493965051,
        "HYP": 0.1649878003961937
      },
      "excluded_statements": [
        35,
        36,
        37,
        38,
        39,
        40,
        41,
        42,
        43,
        44,
        46,
        47,
        48,
        49,
        50,
        51,
        52,
        53,
        54,
        55,
        56,
        57,
        58,
        59,
        61,
        62,
        63,
        65,
        66,
        67,
        68,
        69,
        70
      ],
      "n_params": 0,
      "selection_trace": null
    },
    {
      "method": "asl",
      "calibrator": "C1_temp_scalar",
      "seed": 123,
      "backbone": "simpleresnet1d_4m",
      "is_selected": false,
      "macro_auc": 0.9111371626565808,
      "labelwise_ece": 0.03311496779202011,
      "macro_brier": 0.01388292087976405,
      "calib_slope": 1.3001321061838824,
      "calib_intercept": -0.5311012918471846,
      "threshold_transfer_gap_at_sens_0.9": 0.07445558867200543,
      "family_ece": {
        "NORM": 0.03841846365619801,
        "MI": 0.037943096007316456,
        "STTC": 0.0252243128745481,
        "CD": 0.049427238988740706,
        "HYP": 0.026513590605104474
      },
      "excluded_statements": [
        35,
        36,
        37,
        38,
        39,
        40,
        41,
        42,
        43,
        44,
        46,
        47,
        48,
        49,
        50,
        51,
        52,
        53,
        54,
        55,
        56,
        57,
        58,
        59,
        61,
        62,
        63,
        65,
        66,
        67,
        68,
        69,
        70
      ],
      "n_params": 1,
      "selection_trace": null
    },
    {
      "method": "asl",
      "calibrator": "C2_temp_per_label",
      "seed": 123,
      "backbone": "simpleresnet1d_4m",
      "is_selected": false,
      "macro_auc": 0.9111371626565808,
      "labelwise_ece": 0.020812640274457613,
      "macro_brier": 0.013251663804881717,
      "calib_slope": 1.0139214768488192,
      "calib_intercept": -0.6096085235892955,
      "threshold_transfer_gap_at_sens_0.9": 0.07445558867200543,
      "family_ece": {
        "NORM": 0.03984640119761505,
        "MI": 0.02395998674245337,
        "STTC": 0.013725332590069845,
        "CD": 0.03586534348163613,
        "HYP": 0.009350703384098116
      },
      "excluded_statements": [
        35,
        36,
        37,
        38,
        39,
        40,
        41,
        42,
        43,
        44,
        46,
        47,
        48,
        49,
        50,
        51,
        52,
        53,
        54,
        55,
        56,
        57,
        58,
        59,
        61,
        62,
        63,
        65,
        66,
        67,
        68,
        69,
        70
      ],
      "n_params": 71,
      "selection_trace": null
    },
    {
      "method": "asl",
      "calibrator": "C3_per_label_affine",
      "seed": 123,
      "backbone": "simpleresnet1d_4m",
      "is_selected": false,
      "macro_auc": 0.9111371626565808,
      "labelwise_ece": 0.01107453268091975,
      "macro_brier": 0.011147254397608563,
      "calib_slope": 1.5806789174545142,
      "calib_intercept": 1.1220872155499972,
      "threshold_transfer_gap_at_sens_0.9": 0.07445558867200543,
      "family_ece": {
        "NORM": 0.02433682948164896,
        "MI": 0.010825043129684872,
        "STTC": 0.00921804002006119,
        "CD": 0.01199998940108729,
        "HYP": 0.012740772577728487
      },
      "excluded_statements": [
        35,
        36,
        37,
        38,
        39,
        40,
        41,
        42,
        43,
        44,
        46,
        47,
        48,
        49,
        50,
        51,
        52,
        53,
        54,
        55,
        56,
        57,
        58,
        59,
        61,
        62,
        63,
        65,
        66,
        67,
        68,
        69,
        70
      ],
      "n_params": 142,
      "selection_trace": null
    },
    {
      "method": "asl",
      "calibrator": "C4_family_affine",
      "seed": 123,
      "backbone": "simpleresnet1d_4m",
      "is_selected": false,
      "macro_auc": 0.9111371626565808,
      "labelwise_ece": 0.015642814520251683,
      "macro_brier": 0.011479994289129743,
      "calib_slope": 1.578874654055081,
      "calib_intercept": 1.1948792234426129,
      "threshold_transfer_gap_at_sens_0.9": 0.07445558867200543,
      "family_ece": {
        "NORM": 0.06576309091811622,
        "MI": 0.014306168833654634,
        "STTC": 0.012322749779238891,
        "CD": 0.015310974879431604,
        "HYP": 0.019991615383030455
      },
      "excluded_statements": [
        35,
        36,
        37,
        38,
        39,
        40,
        41,
        42,
        43,
        44,
        46,
        47,
        48,
        49,
        50,
        51,
        52,
        53,
        54,
        55,
        56,
        57,
        58,
        59,
        61,
        62,
        63,
        65,
        66,
        67,
        68,
        69,
        70
      ],
      "n_params": 10,
      "selection_trace": null
    },
    {
      "method": "asl",
      "calibrator": "C5_isotonic",
      "seed": 123,
      "backbone": "simpleresnet1d_4m",
      "is_selected": true,
      "macro_auc": 0.9036625189997881,
      "labelwise_ece": 0.006187968174886109,
      "macro_brier": 0.012333106649258746,
      "calib_slope": 0.801191111632437,
      "calib_intercept": -0.6506367534294281,
      "threshold_transfer_gap_at_sens_0.9": 0.08247130313102537,
      "family_ece": {
        "NORM": 0.023498870390005495,
        "MI": 0.006401229957583656,
        "STTC": 0.005965097745260485,
        "CD": 0.005428925990616697,
        "HYP": 0.005953359253865242
      },
      "excluded_statements": [
        35,
        36,
        37,
        38,
        39,
        40,
        41,
        42,
        43,
        44,
        46,
        47,
        48,
        49,
        50,
        51,
        52,
        53,
        54,
        55,
        56,
        57,
        58,
        59,
        61,
        62,
        63,
        65,
        66,
        67,
        68,
        69,
        70
      ],
      "n_params": 200,
      "selection_trace": {
        "trace": "ece_unique",
        "band": [
          "C5_isotonic"
        ],
        "se": 0.0003767406548989157
      }
    },
    {
      "method": "asl",
      "calibrator": "C0_raw",
      "seed": 2024,
      "backbone": "simpleresnet1d_4m",
      "is_selected": false,
      "macro_auc": 0.9150733537841637,
      "labelwise_ece": 0.13767349393694697,
      "macro_brier": 0.02925726619697846,
      "calib_slope": 3.5048847846056965,
      "calib_intercept": -0.10038211587106229,
      "threshold_transfer_gap_at_sens_0.9": 0.08354008025734265,
      "family_ece": {
        "NORM": 0.1294546087591945,
        "MI": 0.13116113164689963,
        "STTC": 0.1412747141530373,
        "CD": 0.13986806671058227,
        "HYP": 0.15919644592255486
      },
      "excluded_statements": [
        35,
        36,
        37,
        38,
        39,
        40,
        41,
        42,
        43,
        44,
        46,
        47,
        48,
        49,
        50,
        51,
        52,
        53,
        54,
        55,
        56,
        57,
        58,
        59,
        61,
        62,
        63,
        65,
        66,
        67,
        68,
        69,
        70
      ],
      "n_params": 0,
      "selection_trace": null
    },
    {
      "method": "asl",
      "calibrator": "C1_temp_scalar",
      "seed": 2024,
      "backbone": "simpleresnet1d_4m",
      "is_selected": false,
      "macro_auc": 0.9150733410443573,
      "labelwise_ece": 0.03630892481113012,
      "macro_brier": 0.01438652944727359,
      "calib_slope": 1.256661975866093,
      "calib_intercept": -0.47736044537879896,
      "threshold_transfer_gap_at_sens_0.9": 0.08354008025734265,
      "family_ece": {
        "NORM": 0.1189099357208688,
        "MI": 0.030637541847467975,
        "STTC": 0.0324674244015197,
        "CD": 0.04073349251023015,
        "HYP": 0.042541679457664794
      },
      "excluded_statements": [
        35,
        36,
        37,
        38,
        39,
        40,
        41,
        42,
        43,
        44,
        46,
        47,
        48,
        49,
        50,
        51,
        52,
        53,
        54,
        55,
        56,
        57,
        58,
        59,
        61,
        62,
        63,
        65,
        66,
        67,
        68,
        69,
        70
      ],
      "n_params": 1,
      "selection_trace": null
    },
    {
      "method": "asl",
      "calibrator": "C2_temp_per_label",
      "seed": 2024,
      "backbone": "simpleresnet1d_4m",
      "is_selected": false,
      "macro_auc": 0.9150733537841637,
      "labelwise_ece": 0.024036198229248747,
      "macro_brier": 0.013530478477607482,
      "calib_slope": 0.9222932216264419,
      "calib_intercept": -0.6875384015666901,
      "threshold_transfer_gap_at_sens_0.9": 0.08354008025734265,
      "family_ece": {
        "NORM": 0.11695423530197756,
        "MI": 0.023291438167677227,
        "STTC": 0.017812802597835773,
        "CD": 0.02674564918182755,